{
  "candidate_id": "C_17695f77cce2b970",
  "counter_evidence_fact_ids": [],
  "daily_fact_ids": [],
  "eligibility": "eligible",
  "family": "scale_winner",
  "origin": "detector",
  "overlap_group_ids": [],
  "peer_fact_ids": [],
  "period_id": "P_33772305a17781ae",
  "quality_issue_ids": [
    "Q_d330064a917350e6"
  ],
  "rejection_reason": null,
  "segment_id": "G_f49a462c043bccf6",
  "trigger_fact_ids": [
    "F_bb75982385c0ca2d"
  ]
}
